{
  "$schema": "https://json-schema.org/draft/2020-12/schema",
  "title": "WARDEN implement artifact",
  "type": "object",
  "required": ["summary", "files_changed"],
  "additionalProperties": false,
  "properties": {
    "summary": { "type": "string", "minLength": 5 },
    "files_changed": { "type": "array", "items": { "type": "string" }, "minItems": 1 },
    "diff_hash": { "type": "string" },
    "flags": { "type": "array", "items": { "type": "string" } }
  }
}
