{
  "summary": "Successfully created hello.py that prints 'hello world' and test_hello.py with two pytest tests that verify the module works correctly. All tests pass.",
  "files_changed": [
    "hello.py",
    "test_hello.py"
  ],
  "diff_hash": "26b5c3f8a4d9e1f2c3e4f5a6b7c8d9e0f1a2b3c",
  "flags": []
}
